{
  "schema_version": "1.0.0",
  "ai_id": "AI-0001",
  "name": "Synthetic Document Assistant",
  "department": "Example Department",
  "description": "A fictional assistant used only to demonstrate the repository data model.",
  "ownership": {"sponsor": "Example Sponsor", "business_owner": "Example Process Owner", "coe_owner": "Example COE Owner"},
  "governance": {"phase": "solution_testing", "substage": "pilot", "gate_status": "approved_with_conditions", "priority": "medium", "build_buy": "configure_existing", "next_gate": "G10", "next_gate_date": "2026-12-15"},
  "inventory": {"bucket": "in_progress", "operational_status": "pilot", "backlog_reason": null, "resolution": null},
  "risk": {"tier": "low", "data_sensitivity": "internal", "resident_facing": false, "public_safety": false, "human_oversight": "human_review_each_output"},
  "licenses": [{"license_id": "LIC-0001", "quantity": 5, "status": "assigned"}],
  "monitoring": null,
  "dates": {"created": "2026-08-01", "last_updated": "2026-09-15", "target_production": "2027-01-15", "go_live": null, "closed": null},
  "links": {"governance_record": "governance/use-cases/AI-0001-synthetic-example"},
  "record_status": "active"
}
